{
  "$schema": "https://json-schema.org/draft/2020-12/schema",
  "$id": "https://espedair.io/schema/business-information-model-concept-domain",
  "title": "Business Information Model Concept-Domain Network",
  "description": "Production schema for flattened Data Concept to Data Domain mappings with complete governance metadata. Supports ERD generation, viewpoint filtering, and domain-based navigation.",
  "type": "object",
  "additionalProperties": false,
  "required": [
    "name",
    "mappings"
  ],
  "properties": {
    "$schema": {
      "type": "string",
      "description": "Reference to the schema definition"
    },
    "name": {
      "type": "string",
      "description": "Identifier for the concept-domain mapping (e.g., insignia_business_information_model_concept_domain)"
    },
    "description": {
      "type": "string",
      "description": "Human-readable description of the mapping purpose and scope"
    },
    "source": {
      "type": "string",
      "description": "Source identifier or document reference (e.g., 'Business Information Model')"
    },
    "generated_at_utc": {
      "type": "string",
      "format": "date-time",
      "description": "ISO 8601 timestamp of when the mapping was generated"
    },
    "stats": {
      "type": "object",
      "description": "Comprehensive statistics about the concept-domain network",
      "additionalProperties": false,
      "properties": {
        "total_mappings": {
          "type": "integer",
          "minimum": 0,
          "description": "Total number of concept-domain mappings"
        },
        "unique_domains": {
          "type": "integer",
          "minimum": 0,
          "description": "Count of unique Data Domains"
        },
        "unique_concepts": {
          "type": "integer",
          "minimum": 0,
          "description": "Count of unique Data Concepts mapped to domains"
        },
        "avg_concepts_per_domain": {
          "type": "number",
          "minimum": 0,
          "description": "Average number of concepts per domain"
        },
        "hierarchical_relationships": {
          "type": "integer",
          "minimum": 0,
          "description": "Count of concept grouping relationships (concept->concept or concept->domain)"
        }
      }
    },
    "mappings": {
      "type": "array",
      "description": "Array of concept-to-domain mappings with complete governance metadata",
      "items": {
        "type": "object",
        "additionalProperties": false,
        "required": [
          "concept_name",
          "domain_name",
          "concept_asset_type",
          "domain_asset_type"
        ],
        "properties": {
          "concept_name": {
            "type": "string",
            "description": "Name of the Data Concept"
          },
          "concept_asset_type": {
            "type": "string",
            "description": "Asset type of the concept (e.g., Data Concept, Data Element)"
          },
          "domain_name": {
            "type": "string",
            "description": "Name of the Data Domain"
          },
          "domain_asset_type": {
            "type": "string",
            "description": "Asset type of the domain (e.g., Data Domain)"
          },
          "concept_description": {
            "type": "string",
            "description": "Business definition of the concept"
          },
          "information_confidentiality_classification": {
            "type": "string",
            "description": "Data classification level (Public, Internal, Confidential, Highly Confidential, Restricted)"
          },
          "parent_concept_name": {
            "type": "string",
            "description": "Name of parent concept if this concept is grouped by another concept"
          },
          "child_concepts": {
            "type": "array",
            "description": "Names of child concepts grouped by this concept",
            "items": {
              "type": "string"
            }
          }
        }
      }
    },
    "domain_index": {
      "type": "array",
      "description": "Index of domains with concept counts for quick lookup and validation",
      "items": {
        "type": "object",
        "additionalProperties": false,
        "required": [
          "domain_name",
          "domain_asset_type",
          "concept_count"
        ],
        "properties": {
          "domain_name": {
            "type": "string",
            "description": "Name of the Data Domain"
          },
          "domain_asset_type": {
            "type": "string",
            "description": "Asset type (e.g., Data Domain)"
          },
          "concept_count": {
            "type": "integer",
            "minimum": 0,
            "description": "Number of concepts in this domain"
          },
          "concepts": {
            "type": "array",
            "description": "List of concept names in this domain",
            "items": {
              "type": "string"
            }
          },
          "confidentiality_levels": {
            "type": "array",
            "description": "Unique confidentiality classifications in this domain",
            "items": {
              "type": "string"
            }
          }
        }
      }
    }
  }
}
