{
  "$schema": "../bim/concept/business-information-model-concept-domain.schema.json",
  "name": "insignia_business_information_model_concept_domain",
  "description": "Flattened Data Concept to Data Domain mapping for ERD/viewpoint generation.",
  "source": "Business Information Model",
  "generated_at_utc": "2026-03-25T20:34:04+00:00",
  "stats": {
    "total_mappings": 79,
    "unique_domains": 13,
    "unique_concepts": 79,
    "avg_concepts_per_domain": 6.08,
    "hierarchical_relationships": 53
  },
  "mappings": [
    {
      "concept_name": "Advice Audit Information",
      "concept_asset_type": "Data Concept",
      "domain_name": "Advice",
      "domain_asset_type": "Data Domain",
      "concept_description": "Audit conducted by Insignia as AFSL holder",
      "information_confidentiality_classification": "Confidential",
      "parent_concept_name": "",
      "child_concepts": []
    },
    {
      "concept_name": "Advice Investment Committee",
      "concept_asset_type": "Data Concept",
      "domain_name": "Advice",
      "domain_asset_type": "Data Domain",
      "concept_description": "Review and approve product listing",
      "information_confidentiality_classification": "Internal",
      "parent_concept_name": "",
      "child_concepts": []
    },
    {
      "concept_name": "Adviser",
      "concept_asset_type": "Data Concept",
      "domain_name": "Advice",
      "domain_asset_type": "Data Domain",
      "concept_description": "Individual qualified and authorised to dispense financial advice under Australian Financial Services License rules and regulations",
      "information_confidentiality_classification": "Highly Confidential",
      "parent_concept_name": "",
      "child_concepts": [
        "Financial Advisers Register"
      ]
    },
    {
      "concept_name": "Fact Finding",
      "concept_asset_type": "Data Concept",
      "domain_name": "Advice",
      "domain_asset_type": "Data Domain",
      "concept_description": "Collection of financial information of client to guide and support advice to be provided.",
      "information_confidentiality_classification": "Confidential",
      "parent_concept_name": "",
      "child_concepts": [
        "Personal Financial Position"
      ]
    },
    {
      "concept_name": "Fee Structure",
      "concept_asset_type": "Data Concept",
      "domain_name": "Advice",
      "domain_asset_type": "Data Domain",
      "concept_description": "Disclosure of fee structure for financial advice and actioning plan",
      "information_confidentiality_classification": "Confidential",
      "parent_concept_name": "",
      "child_concepts": []
    },
    {
      "concept_name": "File Notes",
      "concept_asset_type": "Data Concept",
      "domain_name": "Advice",
      "domain_asset_type": "Data Domain",
      "concept_description": "Captures the key information discussed during an interaction with customer",
      "information_confidentiality_classification": "Highly Confidential",
      "parent_concept_name": "",
      "child_concepts": []
    },
    {
      "concept_name": "Letter of Engagement",
      "concept_asset_type": "Data Concept",
      "domain_name": "Advice",
      "domain_asset_type": "Data Domain",
      "concept_description": "Acknowledgement from client to proceed with advice, includes fees for advice",
      "information_confidentiality_classification": "Confidential",
      "parent_concept_name": "",
      "child_concepts": []
    },
    {
      "concept_name": "Nature of Advice",
      "concept_asset_type": "Data Concept",
      "domain_name": "Advice",
      "domain_asset_type": "Data Domain",
      "concept_description": "General in nature, Scaled (simple advisor guided or calculator, for single fund), Comprehensive (full financial circumstance considered)",
      "information_confidentiality_classification": "Confidential",
      "parent_concept_name": "",
      "child_concepts": []
    },
    {
      "concept_name": "Product Research",
      "concept_asset_type": "Data Concept",
      "domain_name": "Advice",
      "domain_asset_type": "Data Domain",
      "concept_description": "Product details of performance, construct and fees across various financial providers for the advice being put forward",
      "information_confidentiality_classification": "Internal",
      "parent_concept_name": "",
      "child_concepts": [
        "Product Comparison"
      ]
    },
    {
      "concept_name": "Prospective Customer",
      "concept_asset_type": "Data Concept",
      "domain_name": "Advice",
      "domain_asset_type": "Data Domain",
      "concept_description": "Relationship between Advisor and Prospective Client where no statement of advice has been signed",
      "information_confidentiality_classification": "Internal",
      "parent_concept_name": "",
      "child_concepts": []
    },
    {
      "concept_name": "Statement of Advice",
      "concept_asset_type": "Data Concept",
      "domain_name": "Advice",
      "domain_asset_type": "Data Domain",
      "concept_description": "Statement of Advice is information of financial plan put forward by advisor to client based on products and fact finding details. Including risks, strategies and financial circumstance.",
      "information_confidentiality_classification": "Highly Confidential",
      "parent_concept_name": "",
      "child_concepts": [
        "Record of Advice Amendment"
      ]
    },
    {
      "concept_name": "Company Board",
      "concept_asset_type": "Data Concept",
      "domain_name": "Corporate Governance",
      "domain_asset_type": "Data Domain",
      "concept_description": "Company board information to support and guide governance of organisation",
      "information_confidentiality_classification": "Confidential",
      "parent_concept_name": "",
      "child_concepts": [
        "Board Meeting Minutes"
      ]
    },
    {
      "concept_name": "Company Group",
      "concept_asset_type": "Data Concept",
      "domain_name": "Corporate Governance",
      "domain_asset_type": "Data Domain",
      "concept_description": "Insignia stock exchange listing information",
      "information_confidentiality_classification": "Confidential",
      "parent_concept_name": "",
      "child_concepts": [
        "Share Listing"
      ]
    },
    {
      "concept_name": "Corporate Policies and Standards",
      "concept_asset_type": "Data Concept",
      "domain_name": "Corporate Governance",
      "domain_asset_type": "Data Domain",
      "concept_description": "The guiding principles and rules to adhere to across key responsibility areas at Insignia. Policy documents for areas such as risk, data, diversity and inclusion, responsible investment",
      "information_confidentiality_classification": "Internal",
      "parent_concept_name": "",
      "child_concepts": []
    },
    {
      "concept_name": "Member / Investor Representation",
      "concept_asset_type": "Data Concept",
      "domain_name": "Corporate Governance",
      "domain_asset_type": "Data Domain",
      "concept_description": "Details to provide board with oversight of member/investors focused outcomes. Member Office and Office of Responsible Entity ensure interests of members/investors are adhered to with regards to trusts.",
      "information_confidentiality_classification": "Highly Confidential",
      "parent_concept_name": "",
      "child_concepts": [
        "Business Performance Review"
      ]
    },
    {
      "concept_name": "Responsible Entity",
      "concept_asset_type": "Data Concept",
      "domain_name": "Corporate Governance",
      "domain_asset_type": "Data Domain",
      "concept_description": "Information concept that covers all the governance and finance concepts in the BIM for IFL, which are replicated at the trust level, which may have different information ownership",
      "information_confidentiality_classification": "Highly Confidential",
      "parent_concept_name": "",
      "child_concepts": []
    },
    {
      "concept_name": "Trust",
      "concept_asset_type": "Data Concept",
      "domain_name": "Corporate Governance",
      "domain_asset_type": "Data Domain",
      "concept_description": "Information concept that covers all the governance and finance concepts in the BIM for IFL, which are replicated at the trust level, which may have different information ownership",
      "information_confidentiality_classification": "Highly Confidential",
      "parent_concept_name": "",
      "child_concepts": []
    },
    {
      "concept_name": "Advice Complaint",
      "concept_asset_type": "Data Concept",
      "domain_name": "Enquiries and Complaints",
      "domain_asset_type": "Data Domain",
      "concept_description": "Insignia investigation into advice provided to client by advisor, evidence and findings",
      "information_confidentiality_classification": "Highly Confidential",
      "parent_concept_name": "",
      "child_concepts": [
        "Advice Complaint Investigation"
      ]
    },
    {
      "concept_name": "Demand",
      "concept_asset_type": "Data Concept",
      "domain_name": "Enquiries and Complaints",
      "domain_asset_type": "Data Domain",
      "concept_description": "Customer or Advisor initiated interaction with Insignia Financial re financial account",
      "information_confidentiality_classification": "Highly Confidential",
      "parent_concept_name": "",
      "child_concepts": [
        "Demand Resolution"
      ]
    },
    {
      "concept_name": "Demand Analytics",
      "concept_asset_type": "Data Concept",
      "domain_name": "Enquiries and Complaints",
      "domain_asset_type": "Data Domain",